{
  "$schema": "https://json-schema.org/draft/2020-12/schema",
  "$id": "urn:siso:great-library:schema:source-inventory:1",
  "type": "object",
  "additionalProperties": false,
  "required": ["schema_version", "record_type", "id", "name", "source_work_id", "observed_at", "inventory_state", "preservation", "units", "evidence"],
  "properties": {
    "schema_version": { "const": "1.0.0" },
    "record_type": { "const": "source_inventory" },
    "id": { "$ref": "common.schema.json#/$defs/sourceInventoryId" },
    "name": { "type": "string", "minLength": 1 },
    "source_work_id": { "$ref": "common.schema.json#/$defs/workId" },
    "observed_at": { "type": "string", "format": "date" },
    "inventory_state": { "enum": ["partial", "mapped", "reconciled", "retired"] },
    "preservation": {
      "type": "object",
      "additionalProperties": false,
      "required": ["mode", "dirty_entries", "reason", "nested_repositories"],
      "properties": {
        "mode": { "enum": ["read_only", "bridge_before_move", "clean"] },
        "dirty_entries": { "type": "integer", "minimum": 0 },
        "reason": { "type": "string", "minLength": 3 },
        "nested_repositories": {
          "type": "array",
          "items": {
            "type": "object",
            "additionalProperties": false,
            "required": ["path", "remote", "branch", "dirty_entries", "preservation"],
            "properties": {
              "path": { "type": "string", "minLength": 1 },
              "remote": { "type": "string", "format": "uri" },
              "branch": { "type": "string", "minLength": 1 },
              "dirty_entries": { "type": "integer", "minimum": 0 },
              "preservation": { "type": "string", "minLength": 3 }
            }
          }
        }
      }
    },
    "units": {
      "type": "array",
      "minItems": 1,
      "items": {
        "type": "object",
        "additionalProperties": false,
        "required": ["unit_id", "name", "paths", "classification", "disposition", "target", "rationale", "evidence"],
        "properties": {
          "unit_id": { "type": "string", "pattern": "^[a-z0-9]+(?:-[a-z0-9]+)*$" },
          "name": { "type": "string", "minLength": 1 },
          "paths": { "type": "array", "minItems": 1, "items": { "type": "string", "minLength": 1 } },
          "classification": { "enum": ["current_application", "accepted_work", "candidate_work", "shared_package", "experiment", "external_upstream", "private_state", "data_or_archive", "unverified"] },
          "disposition": { "enum": ["keep", "link_existing", "extract", "compare", "preserve_external", "move_to_shared_library", "move_to_private_store", "move_to_data_store", "vault", "distribute_to_owners"] },
          "target": { "type": "string", "minLength": 1 },
          "rationale": { "type": "string", "minLength": 10 },
          "evidence": { "type": "array", "minItems": 1, "items": { "$ref": "common.schema.json#/$defs/evidence" } }
        }
      }
    },
    "evidence": { "type": "array", "minItems": 1, "items": { "$ref": "common.schema.json#/$defs/evidence" } }
  }
}
